Filename,Title,Keywords,Category,Releases
mjpg_00001_.jpg,Pawsome Dreamers: Empowered Pets in Their Element,"Cozy pets, Costumes, Inspirational quotes, Empowerment, Personalities, Cats, Dogs.",,
mjpg_00002_.jpg,Pawsome Pet Inspiration: A Cozy Winter Tale,"cozy pets, winter wonderland, holiday decorations, dogs in costumes, inspirational quotes, best friends, love, contentment, heartwarming scene.",,
mjpg_00003_.jpg,Pawsome Pals: A Quote-filled Cozy Corner,"Cute pets, Themed costumes, Cozy setting, Inspirational quotes, Pets and books, Dogs in sweaters, Cat knitted sweaters.",,
mjpg_00004_.jpg,Pawsome Positivity: A Pet-Inspired Journey,"Themed pets, cute dogs, costumes, cozy cats, inspirational quotes, autumn leaves, winter snow, close-up shots, pet expressions, compassionate quotes.",,
mjpg_00005_.jpg,Pawsome Inspirations: A Blanket Fort of Whiskers and Wags,"Pet inspiration, Cats in blanket fort, Dogs in costume, Inspirational quotes, Cozy pets, Playful animals, Friendship, Love, Resilience",,
mjpg_00006_.jpg,Pawsome Dreamers: Inspiring Tales of Resilience,"Inspirational pet quotes, Cute dogs in costumes, Cozy cats, Resilience, Strength, Motivation, Themed pet content.",,
mjpg_00007_.jpg,Pawsome Dreamers - Inspiring Tales of Courageous Pets,"themed pet content, dogs in costumes, cozy cats, inspirational pet quotes, heartwarming, adorable, resilience, intelligence, love, bonding, pets' stories, unique personalities.",,
mjpg_00008_.jpg,Pawsome Inspiration - A Day in the Life of Pet Heroes,"costume pets, themed animals, inspirational quotes, cozy cats, dogs in costumes, autumn, winter, adopt don't shop.",,
mjpg_00009_.jpg,Pawsome Pals in Party Costumes,"Cute pets, Themed costumes, Cozy interior, Fall decorations, Inspirational quotes, Unconditional love, Cats and dogs, Friendship, Happy pets, Home interior.",,
mjpg_00010_.jpg,Pawsome Pet Positivity: A Day of Inspiration,"Pet Costumes, Cute Animals, Home Setting, Inspirational Quotes, Superhero Dog, Reading Cat, Cozy Atmosphere, Uplifting Messages.",,
mjpg_00011_.jpg,Pawsome Inspirations: A Day in the Life of Our Furry Heroes,"Costume, Pet, Dog, Cat, Cozy, Inspirational, Quotes, Homely, Warmth, Affection, Positivity, Superhero, Fashionable.",,
mjpg_00012_.jpg,Pawsome Dreamers: Aspiring Canines & Inspired Felines,"cute pets, costumes, inspirational quotes, superheroes, cozy cats, aspirational content, pet photography.",,
mjpg_00013_.jpg,Pawsome Inspiration: A Cozy Corner with Furry Friends,"Cozy pets, Autumn theme, Inspiring quotes, Dogs in costumes, Cats in sweaters, Positive messages, Friendship, Love, Resilience.",,
mjpg_00014_.jpg,Pawsome Pet Inspirations,"pet costumes, adorable pets, cozy setting, superhero, motivation, inspirational quotes, bond, friendship, living room, cute cats, dogs in clothing.",,
mjpg_00015_.jpg,Whiskers of Wisdom: Inspirational Pet Quotes Amidst Cozy Comfort,"Cozy, Inspirational, Pets, Costumes, Quotes, Living Room, Adorable, Wisdom, Unconditional Love, Home Décor, Positive Affirmations, Furry Friends, Pet-themed Decor.",,
mjpg_00016_.jpg,Pawsome Pals: A Cozy Corner of Inspiration,"cozy living room, cute pets in costumes, themed pet content, adorable cats, inspirational dog quotes, motivational pet t-shirts, pet-themed decor.",,
mjpg_00017_.jpg,Pawsome Pals: A Blanket Fort of Love,"pets, costumes, themed content, cozy, blanket fort, friendship, inspiration, dogs, cats, heartwarming.",,
mjpg_00018_.jpg,Pawsome Pet Positivity,"Cute pets, Costume party, Inspiring quotes, Cozy interiors, Themed content, Pet photography, Emotional support animals, Positive vibes.",,
mjpg_00019_.jpg,Pawsome Inspirations: A Day with SDXL's Furry Friends,"Themed pet costumes, cozy interiors, autumnal landscapes, playful spirits, warm atmosphere, pet inspiration, pet quotes, adorable pets, themed photography.",,
mjpg_00020_.jpg,Pawsome Tales of Inspiration: A Feline's Journey,"Inspirational, Resilience, Cozy Home, Cat in Costume, Motivational Pet Quotes, Resilient Feline, Unique Personality",,
mjpg_00021_.jpg,Pawsome Dreamers - Inspiring Quotes from Furry Friends,"Themed pets, Costumes, Cozy living room, Inspirational quotes, Adorable dogs, Cats, Positivity, Motivation, Home decor, Pet-themed interior.",,
mjpg_00022_.jpg,Pawsome Pals: A Spark of Inspiration,"pets, costumes, inspiration, cozy, motivation, quotes, dogs, cats, themed content, cute.",,
mjpg_00023_.jpg,Pawsome Inspirations: A Day in the Life of a Furry Motivator,"Cute animals, Inspirational quotes, Home decor, Costumes, Pets in action, Cozy atmosphere, Positive messages, Resilience, Courage, Superhero dogs, Philosopher cats.",,
mjpg_00024_.jpg,Pawsome Pet Inspiration: Dapper Doggos & Snuggly Kitties,"Cute pets, Costumes, Themed content, Cozy cats, Inspirational quotes, Motivational phrases, Diverse collection of dogs, Snuggly settings.",,
mjpg_00025_.jpg,Pawsome Pet Parade: A Celebration of Unconditional Love,"pets in costumes, cozy cats, inspirational quotes, autumn foliage, whimsical decorations, playful dogs, park setting, unconditional love.",,
mjpg_00026_.jpg,Pawsome Inspirations: A Day at PetVille,"Cute dogs, Themed pet content, Costume party, Inspirational quotes, Cozy pets, Festive accessories, Pet lifestyle, Wholesome images, Positive vibes.",,
mjpg_00027_.jpg,Pawsome Inspirations: A Tale of Resilience,"Cute pets in costumes, Cozy interiors, Motivational pet quotes, Autumn scene, Resilience, Inspirational animals, Themed content.",,
mjpg_00028_.jpg,Pawsome Dreamers: Aspiring Canine Companions,"Dogs in Costume, Cozy Environment, Inspirational Quotes, Motivation, Cute Pets, Positivity, Dreams, Aspiration.",,
mjpg_00029_.jpg,Pawsome Dreamers - Aspiring Canine Companions,"Inspirational pet quotes, Adorable dogs in costumes, Cats, Cozy setting, Motivation, Self-discovery, Dream big, Believe, Encouragement",,
mjpg_00030_.jpg,Pawsome Pals in Quotes: A Day of Inspiration,"Cozy, Cute, Inspiring, Themed, Costume, Pets, Home, Quotes, Love, Joy, Happiness, Adorable, Companionship",,
mjpg_00031_.jpg,Pawsome Inspirations: A Daily Dose of Pet Motivation,"Cute, Themed Pet Content, Dogs in Costumes, Cozy Cats, Inspirational Quotes, Motivation, Calendar Photoshoot, Decorative Elements, Playful Pup, Cozy Feline, Superhero, Bookshelf, Warm Blanket.",,
mjpg_00032_.jpg,Pawsome Quotes & Cuddly Companions,"Inspirational, Pets, Costume, Dogs, Cats, Quote, Themed, Cozy, Adorable, Heartwarming, Compilation",,
mjpg_00033_.jpg,Pawsome Dreamers: Inspiring Tails of Perseverance,"Dogs in costumes, Cozy cats, Pet quotes, Resilience, Companionship, Heartwarming, Inspirational, Pawsome Dreamers.",,
mjpg_00034_.jpg,Pawsome Inspirations: A Celebration of Pet Power,"dogs in costumes, cozy cats, inspirational pet quotes, rustic setting, festive atmosphere, warm and charming, love and resilience.",,
mjpg_00035_.jpg,Pawsome Inspiration: A Day in the Life of SDXL Pets,"Pet, Inspiration, Themed, Costume, Cozy, Quotes, Love, Companionship, Heartwarming, Adorable, SDXL.",,
mjpg_00036_.jpg,Pawsome Dreamers: Aspiring Canines & Felines in their Inspiring Habitat,"themed pets, dogs in costumes, cozy cats, inspirational quotes, pet-friendly habitat, motivational, heartwarming, adorable, positive vibes, creative, aspirational.",,
mjpg_00037_.jpg,Pawsome Pals: Cozy Corners & Inspiring Tails,"Cute pets in costumes, cozy living room, autumn, inspirational quotes, knitted blankets, adorable pets.",,
mjpg_00038_.jpg,Pawsome Pet Emporium: A Tail of Inspiration,"Pet store, Dog costumes, Cats, Inspirational quotes, Themed content, Playful pets, Cozy cats, Joyful atmosphere",,
mjpg_00039_.jpg,Pawsome Dreamers: Inspiring Tales of Resilience,"Pet portraits, costume themes, inspirational quotes, resilience, spirit animals, heartwarming stories, cozy settings, sunlit interiors, adorable pets, themed content, positive vibes, resilient spirits, pet-human bond, motivational messages.",,
mjpg_00040_.jpg,Pawsome Inspirations: A Blizzard of Motivation,"winter scene, cozy, pets, dogs, cats, costumes, inspirational quotes, Siberian Husky, Siamese cat, snowflake sweater, motivational sign, couch, cushions",,
mjpg_00041_.jpg,Pawsome Dreamers: Aspiring Canines in Costumes,"dogs in costumes, themed pet content, cozy cats, inspirational pet quotes, professional dog costumes, aspirational pets, pet motivation, cute animals, positive affirmations.",,
mjpg_00042_.jpg,Pawsome Inspiration: A Quotespetual Journey,"pets, costumes, inspiration, quotes, cozy, themed content, SDXL.",,
mjpg_00043_.jpg,Pawsome Dreamers: A Celebration of Resilience,"Pet inspiration, cute pets, dog costumes, cat cozy, motivational quotes, resilience, pawsome dreamers, uplifting images",,
mjpg_00044_.jpg,Pawsome Dreamers - Aspiring Canines & Felines,"pet costumes, themed content, inspirational quotes, cute dogs, cuddly cats, aspirations, dreams, achievement, home decor, pet accessories, motivational images.",,
mjpg_00045_.jpg,Pawsome Pals: A Blizzard of Love,"Winter, Pets, Costume, Friendship, Inspirational, Cozy, Love, Bond, Quote, Snowy Day, Blanket, Cute, Themed Content.",,
mjpg_00046_.jpg,Whiskers of Wisdom: Cozy Kitties and Inspiring Pet Quotes,"Cats, Cozy, Themed Costumes, Winter, Inspirational Quotes, Love, Friendship, Resilience, Adorable, Kittens, Heartwarming.",,
mjpg_00047_.jpg,Pawsome Tales: A Daily Dose of Pet Inspiration,"Cute pets, Costume party, Cozy home, Inspirational quotes, Positive vibes, Pet happiness, Furry friends, Home sweet home, Quotes for pets, Pet-inspired quotes",,
mjpg_00048_.jpg,Pawsome Pet Inspirations: A Cozy Quote Corner,"Cute pets, Costume party, Cozy interiors, Pet quotes, Inspiration, Themed content, SDXL.",,
mjpg_00049_.jpg,Pawsome Dreamers: A Spark of Inspiration,"Themed pets, costumes, cozy, inspirational, pet quotes, resilience, love, bonding, cute dogs, adorable cats, themed interiors, motivational, positive messages, uplifting content.",,
mjpg_00050_.jpg,Pawsome Pet Posse: A Day of Inspiration,"Adorable pets, Costumes, Cozy atmosphere, Inspirational quotes, Positivity, Pet quotes, Festive, Camaraderie.",,
